<?xml version="1.0" encoding="utf-8" standalone="yes"?><urlset xmlns="http://www.sitemaps.org/schemas/sitemap/0.9" xmlns:xhtml="http://www.w3.org/1999/xhtml"><url><loc>https://modernapps.ninja/event/officehours_7-16-21/</loc><lastmod>2021-07-16T07:30:00+00:00</lastmod></url><url><loc>https://modernapps.ninja/event/digitaltrans_5-14-21/</loc><lastmod>2021-05-14T08:00:00+00:00</lastmod></url><url><loc>https://modernapps.ninja/event/officehours_7-23-21/</loc><lastmod>2021-07-23T07:30:00+00:00</lastmod></url><url><loc>https://modernapps.ninja/event/digitaltrans_5-21-21/</loc><lastmod>2021-05-21T08:00:00+00:00</lastmod></url><url><loc>https://modernapps.ninja/event/officehours_7-30-21/</loc><lastmod>2021-07-30T07:30:00+00:00</lastmod></url><url><loc>https://modernapps.ninja/event/digitaltrans_5-28-21/</loc><lastmod>2021-05-28T08:00:00+00:00</lastmod></url><url><loc>https://modernapps.ninja/</loc><lastmod>2021-07-30T08:00:00+00:00</lastmod></url><url><loc>https://modernapps.ninja/event/</loc><lastmod>2021-07-30T08:00:00+00:00</lastmod></url><url><loc>https://modernapps.ninja/event/srelive_7-30-21/</loc><lastmod>2021-07-30T08:00:00+00:00</lastmod></url><url><loc>https://modernapps.ninja/event/srelive_7-23-21/</loc><lastmod>2021-07-23T08:00:00+00:00</lastmod></url><url><loc>https://modernapps.ninja/event/srelive_7-16-21/</loc><lastmod>2021-07-16T08:00:00+00:00</lastmod></url><url><loc>https://modernapps.ninja/event/srelive_7-9-21/</loc><lastmod>2021-07-09T08:00:00+00:00</lastmod></url><url><loc>https://modernapps.ninja/event/officehours_7-9-21/</loc><lastmod>2021-07-09T07:30:00+00:00</lastmod></url><url><loc>https://modernapps.ninja/event/officehours_7-02-21/</loc><lastmod>2021-07-02T08:15:00+00:00</lastmod></url><url><loc>https://modernapps.ninja/event/srelive_7-2-21/</loc><lastmod>2021-07-02T08:00:00+00:00</lastmod></url><url><loc>https://modernapps.ninja/event/hackathon_6-18-21/</loc><lastmod>2021-06-25T08:00:00+00:00</lastmod></url><url><loc>https://modernapps.ninja/event/srelive_6-25-21/</loc><lastmod>2021-06-25T08:00:00+00:00</lastmod></url><url><loc>https://modernapps.ninja/event/officehours_6-25-21/</loc><lastmod>2021-06-25T07:30:00+00:00</lastmod></url><url><loc>https://modernapps.ninja/tags/api/</loc><lastmod>2021-06-25T00:00:00+00:00</lastmod></url><url><loc>https://modernapps.ninja/blog/</loc><lastmod>2021-06-25T00:00:00+00:00</lastmod></url><url><loc>https://modernapps.ninja/tags/postman/</loc><lastmod>2021-06-25T00:00:00+00:00</lastmod></url><url><loc>https://modernapps.ninja/blog/postman-collection-for-tanzu-mission-control-rest-apis/</loc><lastmod>2021-06-25T00:00:00+00:00</lastmod></url><url><loc>https://modernapps.ninja/tags/</loc><lastmod>2021-06-25T00:00:00+00:00</lastmod></url><url><loc>https://modernapps.ninja/tags/tanzu-mission-control/</loc><lastmod>2021-06-25T00:00:00+00:00</lastmod></url><url><loc>https://modernapps.ninja/tags/tanzu-portfolio/</loc><lastmod>2021-06-25T00:00:00+00:00</lastmod></url><url><loc>https://modernapps.ninja/tags/data-protection/</loc><lastmod>2021-06-24T00:00:00+00:00</lastmod></url><url><loc>https://modernapps.ninja/tags/tkg/</loc><lastmod>2021-06-24T00:00:00+00:00</lastmod></url><url><loc>https://modernapps.ninja/blog/understanding-data-protection-for-your-vmware-tanzu-container-workloads/</loc><lastmod>2021-06-24T00:00:00+00:00</lastmod></url><url><loc>https://modernapps.ninja/tags/velero/</loc><lastmod>2021-06-24T00:00:00+00:00</lastmod></url><url><loc>https://modernapps.ninja/blog/configure_vsphere_with_tanzu_behind_a_proxy_plus_tkg_extensions/</loc><lastmod>2021-06-21T00:00:00+00:00</lastmod></url><url><loc>https://modernapps.ninja/tags/proxy/</loc><lastmod>2021-06-21T00:00:00+00:00</lastmod></url><url><loc>https://modernapps.ninja/tags/tanzu-kubernetes-grid/</loc><lastmod>2021-06-21T00:00:00+00:00</lastmod></url><url><loc>https://modernapps.ninja/tags/tkg-extensions/</loc><lastmod>2021-06-21T00:00:00+00:00</lastmod></url><url><loc>https://modernapps.ninja/tags/vsphere-with-tanzu/</loc><lastmod>2021-06-21T00:00:00+00:00</lastmod></url><url><loc>https://modernapps.ninja/event/srelive_6-18-21/</loc><lastmod>2021-06-18T08:00:00+00:00</lastmod></url><url><loc>https://modernapps.ninja/tags/active-directory/</loc><lastmod>2021-06-18T00:00:00+00:00</lastmod></url><url><loc>https://modernapps.ninja/tags/dex/</loc><lastmod>2021-06-18T00:00:00+00:00</lastmod></url><url><loc>https://modernapps.ninja/tags/ldap/</loc><lastmod>2021-06-18T00:00:00+00:00</lastmod></url><url><loc>https://modernapps.ninja/tags/pinniped/</loc><lastmod>2021-06-18T00:00:00+00:00</lastmod></url><url><loc>https://modernapps.ninja/blog/tkg-ldap/</loc><lastmod>2021-06-18T00:00:00+00:00</lastmod></url><url><loc>https://modernapps.ninja/tags/nsx-advanced-load-balancer/</loc><lastmod>2021-06-17T00:00:00+00:00</lastmod></url><url><loc>https://modernapps.ninja/tags/nsx-alb/</loc><lastmod>2021-06-17T00:00:00+00:00</lastmod></url><url><loc>https://modernapps.ninja/tags/tanzu-kubernetes/</loc><lastmod>2021-06-17T00:00:00+00:00</lastmod></url><url><loc>https://modernapps.ninja/blog/tkg-nsx-alb/</loc><lastmod>2021-06-17T00:00:00+00:00</lastmod></url><url><loc>https://modernapps.ninja/event/srelive_6-11-21/</loc><lastmod>2021-06-11T08:00:00+00:00</lastmod></url><url><loc>https://modernapps.ninja/blog/tmc-data-protection-s3/</loc><lastmod>2021-06-10T00:00:00+00:00</lastmod></url><url><loc>https://modernapps.ninja/event/srelive_6-4-21/</loc><lastmod>2021-06-04T08:00:00+00:00</lastmod></url><url><loc>https://modernapps.ninja/tags/avs/</loc><lastmod>2021-06-01T00:00:00+00:00</lastmod></url><url><loc>https://modernapps.ninja/blog/tanzu-mission-control-tkg-management-support-and-provisioning-new-clusters/</loc><lastmod>2021-06-01T00:00:00+00:00</lastmod></url><url><loc>https://modernapps.ninja/tags/vmc/</loc><lastmod>2021-06-01T00:00:00+00:00</lastmod></url><url><loc>https://modernapps.ninja/tags/code-stream/</loc><lastmod>2021-05-20T00:00:00+00:00</lastmod></url><url><loc>https://modernapps.ninja/tags/deploy/</loc><lastmod>2021-05-20T00:00:00+00:00</lastmod></url><url><loc>https://modernapps.ninja/tags/tkgs/</loc><lastmod>2021-05-20T00:00:00+00:00</lastmod></url><url><loc>https://modernapps.ninja/blog/using-vra-to-deploy-vsphere-with-tanzu-namespaces-guest-clusters/</loc><lastmod>2021-05-20T00:00:00+00:00</lastmod></url><url><loc>https://modernapps.ninja/tags/vcf/</loc><lastmod>2021-05-20T00:00:00+00:00</lastmod></url><url><loc>https://modernapps.ninja/tags/vra/</loc><lastmod>2021-05-20T00:00:00+00:00</lastmod></url><url><loc>https://modernapps.ninja/tags/harbor/</loc><lastmod>2021-05-17T00:00:00+00:00</lastmod></url><url><loc>https://modernapps.ninja/blog/installing-harbor-using-vm-operator-on-vsphere/</loc><lastmod>2021-05-17T00:00:00+00:00</lastmod></url><url><loc>https://modernapps.ninja/tags/kubernetes/</loc><lastmod>2021-05-17T00:00:00+00:00</lastmod></url><url><loc>https://modernapps.ninja/tags/tanzu/</loc><lastmod>2021-05-17T00:00:00+00:00</lastmod></url><url><loc>https://modernapps.ninja/blog/the-new-modern-workload-on-vsphere/</loc><lastmod>2021-05-17T00:00:00+00:00</lastmod></url><url><loc>https://modernapps.ninja/blog/troubleshooting-vsphere-7-with-kubernetes-tanzu-installation/</loc><lastmod>2021-05-17T00:00:00+00:00</lastmod></url><url><loc>https://modernapps.ninja/tags/kubeapps/</loc><lastmod>2021-05-16T00:00:00+00:00</lastmod></url><url><loc>https://modernapps.ninja/blog/kubeapps-okta-tkg-1-3/</loc><lastmod>2021-05-16T00:00:00+00:00</lastmod></url><url><loc>https://modernapps.ninja/tags/aws/</loc><lastmod>2021-05-13T00:00:00+00:00</lastmod></url><url><loc>https://modernapps.ninja/tags/eks/</loc><lastmod>2021-05-13T00:00:00+00:00</lastmod></url><url><loc>https://modernapps.ninja/blog/using-vra-to-deploy-aws-eks-clusters-and-register-with-tanzu-mission-control/</loc><lastmod>2021-05-13T00:00:00+00:00</lastmod></url><url><loc>https://modernapps.ninja/tags/vrealize-automation/</loc><lastmod>2021-05-13T00:00:00+00:00</lastmod></url><url><loc>https://modernapps.ninja/event/srelive_5-11-21/</loc><lastmod>2021-05-11T01:00:00+00:00</lastmod></url><url><loc>https://modernapps.ninja/event/digitaltrans_5-7-21/</loc><lastmod>2021-05-07T08:00:00+00:00</lastmod></url><url><loc>https://modernapps.ninja/tags/avi/</loc><lastmod>2021-04-29T00:00:00+00:00</lastmod></url><url><loc>https://modernapps.ninja/blog/nsx-advanced-load-balancer-configuration-for-vsphere-with-tanzu/</loc><lastmod>2021-04-29T00:00:00+00:00</lastmod></url><url><loc>https://modernapps.ninja/tags/tanzu-kubernetes-grid-service/</loc><lastmod>2021-04-26T00:00:00+00:00</lastmod></url><url><loc>https://modernapps.ninja/blog/understanding-the-vmware-tanzu-kubernetes-terminology/</loc><lastmod>2021-04-26T00:00:00+00:00</lastmod></url><url><loc>https://modernapps.ninja/tags/cert-manager/</loc><lastmod>2021-04-23T00:00:00+00:00</lastmod></url><url><loc>https://modernapps.ninja/blog/dns-and-certificates-made-simple-for-kubernetes/</loc><lastmod>2021-04-23T00:00:00+00:00</lastmod></url><url><loc>https://modernapps.ninja/tags/external-dns/</loc><lastmod>2021-04-23T00:00:00+00:00</lastmod></url><url><loc>https://modernapps.ninja/course/modernappsskills101_ms4043/</loc><lastmod>2021-04-21T20:27:58+00:00</lastmod></url><url><loc>https://modernapps.ninja/course/</loc><lastmod>2021-04-21T20:27:58+00:00</lastmod></url><url><loc>https://modernapps.ninja/tags/tanzu-portfiolio/</loc><lastmod>2021-04-21T20:27:58+00:00</lastmod></url><url><loc>https://modernapps.ninja/blog/velero-plugin-vsphere/</loc><lastmod>2021-04-21T00:00:00+00:00</lastmod></url><url><loc>https://modernapps.ninja/tags/cloud-native-storage/</loc><lastmod>2021-04-21T00:00:00+00:00</lastmod></url><url><loc>https://modernapps.ninja/blog/tanzu-mission-control-upgrading-kubernetes-for-a-provisioned-cluster/</loc><lastmod>2021-04-21T00:00:00+00:00</lastmod></url><url><loc>https://modernapps.ninja/tags/upgrade/</loc><lastmod>2021-04-21T00:00:00+00:00</lastmod></url><url><loc>https://modernapps.ninja/tags/delete/</loc><lastmod>2021-04-20T00:00:00+00:00</lastmod></url><url><loc>https://modernapps.ninja/blog/log-shipping-using-fluentbit/</loc><lastmod>2021-04-20T00:00:00+00:00</lastmod></url><url><loc>https://modernapps.ninja/blog/tmc-policies/</loc><lastmod>2021-04-20T00:00:00+00:00</lastmod></url><url><loc>https://modernapps.ninja/blog/tanzu-mission-control-delete-a-provisioned-cluster/</loc><lastmod>2021-04-20T00:00:00+00:00</lastmod></url><url><loc>https://modernapps.ninja/blog/upgrade-nsxalb/</loc><lastmod>2021-04-19T00:00:00+00:00</lastmod></url><url><loc>https://modernapps.ninja/blog/tanzu-mission-control-deploying-tkg-clusters-to-aws/</loc><lastmod>2021-04-14T00:00:00+00:00</lastmod></url><url><loc>https://modernapps.ninja/tags/azure/</loc><lastmod>2021-04-09T00:00:00+00:00</lastmod></url><url><loc>https://modernapps.ninja/blog/deploying-tanzu-kubernetes-grid-workload-cluster-to-microsoft-azure/</loc><lastmod>2021-04-09T00:00:00+00:00</lastmod></url><url><loc>https://modernapps.ninja/tags/deployment/</loc><lastmod>2021-04-09T00:00:00+00:00</lastmod></url><url><loc>https://modernapps.ninja/tags/tgk/</loc><lastmod>2021-04-09T00:00:00+00:00</lastmod></url><url><loc>https://modernapps.ninja/blog/deploying-tanzu-kubernetes-grid-management-cluster-to-microsoft-azure/</loc><lastmod>2021-04-07T00:00:00+00:00</lastmod></url><url><loc>https://modernapps.ninja/blog/tkg_on_avs/</loc><lastmod>2021-04-05T00:00:00+00:00</lastmod></url><url><loc>https://modernapps.ninja/blog/external-dns-msdns-tkg13/</loc><lastmod>2021-03-31T00:00:00+00:00</lastmod></url><url><loc>https://modernapps.ninja/blog/tkg-1.3-nsx-alb/</loc><lastmod>2021-03-26T00:00:00+00:00</lastmod></url><url><loc>https://modernapps.ninja/course/vspheretanzu201_vt4599/</loc><lastmod>2021-03-20T15:15:37+00:00</lastmod></url><url><loc>https://modernapps.ninja/blog/deploy-nsx-alb/</loc><lastmod>2021-03-19T00:00:00+00:00</lastmod></url><url><loc>https://modernapps.ninja/course/introtanzustandard_ts7297/</loc><lastmod>2021-03-01T14:21:43+00:00</lastmod></url><url><loc>https://modernapps.ninja/course/vspheretanzu301_vt4163/</loc><lastmod>2021-02-25T00:41:40+00:00</lastmod></url><url><loc>https://modernapps.ninja/blog/adding-a-new-blog-post/</loc><lastmod>2021-02-23T00:00:00+00:00</lastmod></url><url><loc>https://modernapps.ninja/tags/blog/</loc><lastmod>2021-02-23T00:00:00+00:00</lastmod></url><url><loc>https://modernapps.ninja/categories/blog/</loc><lastmod>2021-02-23T00:00:00+00:00</lastmod></url><url><loc>https://modernapps.ninja/categories/</loc><lastmod>2021-02-23T00:00:00+00:00</lastmod></url><url><loc>https://modernapps.ninja/guide/</loc><lastmod>2021-02-23T00:00:00+00:00</lastmod></url><url><loc>https://modernapps.ninja/guide/cka_study_guide/</loc><lastmod>2021-02-23T00:00:00+00:00</lastmod></url><url><loc>https://modernapps.ninja/guide/tanzu_standard_getting_started/</loc><lastmod>2021-02-23T00:00:00+00:00</lastmod></url><url><loc>https://modernapps.ninja/tags/backup/</loc><lastmod>2021-02-22T00:00:00+00:00</lastmod></url><url><loc>https://modernapps.ninja/tags/dataprotection/</loc><lastmod>2021-02-22T00:00:00+00:00</lastmod></url><url><loc>https://modernapps.ninja/blog/harbor-with-selfsigned-certificates-with-tkc/</loc><lastmod>2021-02-22T00:00:00+00:00</lastmod></url><url><loc>https://modernapps.ninja/blog/tmc-data-protection/</loc><lastmod>2021-02-22T00:00:00+00:00</lastmod></url><url><loc>https://modernapps.ninja/blog/vmware-tanzu-mission-control-using-the-data-protection-feature-for-backups-and-restores/</loc><lastmod>2021-02-19T00:00:00+00:00</lastmod></url><url><loc>https://modernapps.ninja/blog/getting-started-with-k8s-blog/</loc><lastmod>2021-02-17T00:00:00+00:00</lastmod></url><url><loc>https://modernapps.ninja/tags/k8s/</loc><lastmod>2021-02-17T00:00:00+00:00</lastmod></url><url><loc>https://modernapps.ninja/categories/k8s/</loc><lastmod>2021-02-17T00:00:00+00:00</lastmod></url><url><loc>https://modernapps.ninja/categories/tanzu-portfolio/</loc><lastmod>2021-02-17T00:00:00+00:00</lastmod></url><url><loc>https://modernapps.ninja/tags/vsphere/</loc><lastmod>2021-02-17T00:00:00+00:00</lastmod></url><url><loc>https://modernapps.ninja/categories/vsphere/</loc><lastmod>2021-02-17T00:00:00+00:00</lastmod></url><url><loc>https://modernapps.ninja/categories/vsphere-with-tanzu/</loc><lastmod>2021-02-17T00:00:00+00:00</lastmod></url><url><loc>https://modernapps.ninja/blog/tmc-intro/</loc><lastmod>2021-02-12T00:00:00+00:00</lastmod></url><url><loc>https://modernapps.ninja/tags/data-persistence-platform/</loc><lastmod>2021-02-04T00:00:00+00:00</lastmod></url><url><loc>https://modernapps.ninja/blog/s3-as-a-service-vsan-dpp/</loc><lastmod>2021-02-04T00:00:00+00:00</lastmod></url><url><loc>https://modernapps.ninja/blog/installing-and-configuring-kasten-to-protect-container-workloads-on-vmware-tanzu-kubernetes-grid/</loc><lastmod>2021-02-03T00:00:00+00:00</lastmod></url><url><loc>https://modernapps.ninja/blog/provision_upgrade_wcp_clusters_tmc/</loc><lastmod>2021-02-01T00:00:00+00:00</lastmod></url><url><loc>https://modernapps.ninja/blog/k8s-cluster-addon-bootstrapping-for-tkg/</loc><lastmod>2021-01-25T00:00:00+00:00</lastmod></url><url><loc>https://modernapps.ninja/blog/deploying-tanzu-sql-to-tanzu-kubernetes-grid-clusters/</loc><lastmod>2021-01-23T00:00:00+00:00</lastmod></url><url><loc>https://modernapps.ninja/tags/tanzu-sql/</loc><lastmod>2021-01-23T00:00:00+00:00</lastmod></url><url><loc>https://modernapps.ninja/tags/fluentbit/</loc><lastmod>2021-01-13T00:00:00+00:00</lastmod></url><url><loc>https://modernapps.ninja/blog/leveraging-fluent-bit-on-tkg-to-send-veba-logs-to-vrli/</loc><lastmod>2021-01-13T00:00:00+00:00</lastmod></url><url><loc>https://modernapps.ninja/tags/logging/</loc><lastmod>2021-01-13T00:00:00+00:00</lastmod></url><url><loc>https://modernapps.ninja/blog/tmc-dp-and-vsphere7-support/</loc><lastmod>2021-01-05T00:00:00+00:00</lastmod></url><url><loc>https://modernapps.ninja/blog/fluent-bit-not-use-tls-tkg-splunk/</loc><lastmod>2021-01-03T00:00:00+00:00</lastmod></url><url><loc>https://modernapps.ninja/tags/nsx-t/</loc><lastmod>2021-01-01T00:00:00+00:00</lastmod></url><url><loc>https://modernapps.ninja/blog/nsx-t-architecture-in-vsphere-with-tanzu-part-1-per-tkg-tier1-vs-per-namespace-tier1/</loc><lastmod>2021-01-01T00:00:00+00:00</lastmod></url><url><loc>https://modernapps.ninja/blog/deploy-kubeapps-tanzu-kubernetes-clusters-vpshere/</loc><lastmod>2020-12-21T00:00:00+00:00</lastmod></url><url><loc>https://modernapps.ninja/blog/tkg-autoscaler/</loc><lastmod>2020-12-10T00:00:00+00:00</lastmod></url><url><loc>https://modernapps.ninja/blog/tanzu-basic-building-tkg-cluster/</loc><lastmod>2020-12-09T00:00:00+00:00</lastmod></url><url><loc>https://modernapps.ninja/tags/vcpp/</loc><lastmod>2020-12-09T00:00:00+00:00</lastmod></url><url><loc>https://modernapps.ninja/tags/tkc/</loc><lastmod>2020-12-04T00:00:00+00:00</lastmod></url><url><loc>https://modernapps.ninja/blog/tkg_cluster_lifecycle_on_vsphere_with_tmc_and_tmc_cli/</loc><lastmod>2020-12-04T00:00:00+00:00</lastmod></url><url><loc>https://modernapps.ninja/tags/tmc/</loc><lastmod>2020-12-04T00:00:00+00:00</lastmod></url><url><loc>https://modernapps.ninja/blog/tanzu-basic-enable-workload-management/</loc><lastmod>2020-11-24T00:00:00+00:00</lastmod></url><url><loc>https://modernapps.ninja/course/vspheretanzu101_vt7301/</loc><lastmod>2020-11-23T15:27:17+06:00</lastmod></url><url><loc>https://modernapps.ninja/blog/vsphere-with-tanzu-troubleshooting-haproxy/</loc><lastmod>2020-11-23T00:00:00+00:00</lastmod></url><url><loc>https://modernapps.ninja/blog/getting-started-with-tanzu-basic/</loc><lastmod>2020-11-19T00:00:00+00:00</lastmod></url><url><loc>https://modernapps.ninja/blog/oidc-enabled-cluster-tkg/</loc><lastmod>2020-10-16T00:00:00+00:00</lastmod></url><url><loc>https://modernapps.ninja/blog/vsphere-with-tanzu-overview/</loc><lastmod>2020-10-13T00:00:00+00:00</lastmod></url><url><loc>https://modernapps.ninja/tags/pks/</loc><lastmod>2020-09-30T00:00:00+00:00</lastmod></url><url><loc>https://modernapps.ninja/blog/tkgi-windows/</loc><lastmod>2020-09-30T00:00:00+00:00</lastmod></url><url><loc>https://modernapps.ninja/tags/tkgi/</loc><lastmod>2020-09-30T00:00:00+00:00</lastmod></url><url><loc>https://modernapps.ninja/blog/harbor-photon/</loc><lastmod>2020-09-02T00:00:00+00:00</lastmod></url><url><loc>https://modernapps.ninja/blog/tmc_cluster-group/</loc><lastmod>2020-08-25T00:00:00+00:00</lastmod></url><url><loc>https://modernapps.ninja/tags/helm/</loc><lastmod>2020-07-21T00:00:00+00:00</lastmod></url><url><loc>https://modernapps.ninja/blog/vsphere-7-with-kubernetes-supercharged-helm-harbor-tkg/</loc><lastmod>2020-07-21T00:00:00+00:00</lastmod></url><url><loc>https://modernapps.ninja/blog/verify_and_troubleshoot_vsphere_7_with_kubernetes/</loc><lastmod>2020-07-17T00:00:00+00:00</lastmod></url><url><loc>https://modernapps.ninja/blog/pks-management-console-day-1/</loc><lastmod>2019-11-27T00:00:00+00:00</lastmod></url><url><loc>https://modernapps.ninja/blog/pks-management-console-day-2/</loc><lastmod>2019-11-27T00:00:00+00:00</lastmod></url><url><loc>https://modernapps.ninja/research/research-1/</loc><lastmod>2019-07-06T15:27:17+06:00</lastmod></url><url><loc>https://modernapps.ninja/research/research-2/</loc><lastmod>2019-07-06T15:27:17+06:00</lastmod></url><url><loc>https://modernapps.ninja/research/research-3/</loc><lastmod>2019-07-06T15:27:17+06:00</lastmod></url><url><loc>https://modernapps.ninja/research/research-4/</loc><lastmod>2019-07-06T15:27:17+06:00</lastmod></url><url><loc>https://modernapps.ninja/research/research-5/</loc><lastmod>2019-07-06T15:27:17+06:00</lastmod></url><url><loc>https://modernapps.ninja/research/research-6/</loc><lastmod>2019-07-06T15:27:17+06:00</lastmod></url><url><loc>https://modernapps.ninja/course/introtanzuportfolio/</loc><lastmod>2019-07-06T15:27:17+06:00</lastmod></url><url><loc>https://modernapps.ninja/notice/</loc><lastmod>2019-07-06T15:27:17+06:00</lastmod></url><url><loc>https://modernapps.ninja/research/</loc><lastmod>2019-07-06T15:27:17+06:00</lastmod></url><url><loc>https://modernapps.ninja/categories/tanzu-mission-control/</loc><lastmod>2019-07-06T15:27:17+06:00</lastmod></url><url><loc>https://modernapps.ninja/course/tmc201/</loc><lastmod>2019-07-06T15:27:17+06:00</lastmod></url><url><loc>https://modernapps.ninja/notice/notice-1/</loc><lastmod>2019-07-06T15:27:17+06:00</lastmod></url><url><loc>https://modernapps.ninja/notice/notice-2/</loc><lastmod>2019-07-06T15:27:17+06:00</lastmod></url><url><loc>https://modernapps.ninja/notice/notice-3/</loc><lastmod>2019-07-06T15:27:17+06:00</lastmod></url><url><loc>https://modernapps.ninja/notice/notice-4/</loc><lastmod>2019-07-06T15:27:17+06:00</lastmod></url><url><loc>https://modernapps.ninja/notice/notice-5/</loc><lastmod>2019-07-06T15:27:17+06:00</lastmod></url><url><loc>https://modernapps.ninja/notice/notice-6/</loc><lastmod>2019-07-06T15:27:17+06:00</lastmod></url><url><loc>https://modernapps.ninja/tags/modernapps-ninja/</loc><lastmod>2001-07-06T15:27:17+06:00</lastmod></url><url><loc>https://modernapps.ninja/categories/modernapps-ninja/</loc><lastmod>2001-07-06T15:27:17+06:00</lastmod></url><url><loc>https://modernapps.ninja/blog/blog-post-1/</loc><lastmod>2001-07-06T15:27:17+06:00</lastmod></url><url><loc>https://modernapps.ninja/categories/tanzu-kubernetes-grid/</loc><lastmod>2001-07-06T15:27:17+06:00</lastmod></url><url><loc>https://modernapps.ninja/about/</loc></url><url><loc>https://modernapps.ninja/contact/</loc></url><url><loc>https://modernapps.ninja/author/</loc></url><url><loc>https://modernapps.ninja/scholarship/scholarship-1/</loc></url><url><loc>https://modernapps.ninja/scholarship/scholarship-2/</loc></url><url><loc>https://modernapps.ninja/scholarship/scholarship-3/</loc></url><url><loc>https://modernapps.ninja/author/john-doe/</loc></url><url><loc>https://modernapps.ninja/author/mark-dinn/</loc></url><url><loc>https://modernapps.ninja/about/membership/</loc></url><url><loc>https://modernapps.ninja/teacher/</loc></url><url><loc>https://modernapps.ninja/scholarship/</loc></url><url><loc>https://modernapps.ninja/about/labs/</loc></url></urlset>